{
    "blockchainName": "ethereum",
    "chainId": 1,
    "contracts": [
        {
            "address": "0x0bb4d3e88243f4a057db77341e6916b0e449b158",
            "contractName": "PoapBridge",
            "selectors": {
                "0xaf68b302": {
                    "erc20OfInterest": [],
                    "method": "mintToken",
                    "plugin": "POAP"
                }
            }
        }
    ],
    "name": "Poap"
}