{
    "blockchainName": "ethereum",
    "chainId": 1,
    "contracts": [
        {
            "address": "0x99361435420711723aF805F08187c9E6bF796683",
            "contractName": "MTbillDepositVault",
            "selectors": {
                "0xc02dd27a": {
                    "erc20OfInterest": [],
                    "method": "depositInstant",
                    "plugin": "Midas"
                },
                "0x6e26b9f8": {
                    "erc20OfInterest": [],
                    "method": "depositRequest",
                    "plugin": "Midas"
                }
            }
        },
        {
            "address": "0xa8a5c4FF4c86a459EBbDC39c5BE77833B3A15d88",
            "contractName": "MBasisDepositVault",
            "selectors": {
                "0xc02dd27a": {
                    "erc20OfInterest": [],
                    "method": "depositInstant",
                    "plugin": "Midas"
                },
                "0x6e26b9f8": {
                    "erc20OfInterest": [],
                    "method": "depositRequest",
                    "plugin": "Midas"
                }
            }
        },
        {
            "address": "0xF6e51d24F4793Ac5e71e0502213a9BBE3A6d4517",
            "contractName": "MTbillRedemptionVault",
            "selectors": {
                "0x8b53f75e": {
                    "erc20OfInterest": [],
                    "method": "redeemInstant",
                    "plugin": "Midas"
                },
                "0xbfc2d46a": {
                    "erc20OfInterest": [],
                    "method": "redeemRequest",
                    "plugin": "Midas"
                },
                "0xd5f73f5c": {
                    "erc20OfInterest": [],
                    "method": "redeemFiatRequest",
                    "plugin": "Midas"
                }
            }
        },
        {
            "address": "0x19AB19e61A930bc5C7B75Bf06cDd954218Ca9F0b",
            "contractName": "MBasisRedemptionVault",
            "selectors": {
                "0x8b53f75e": {
                    "erc20OfInterest": [],
                    "method": "redeemInstant",
                    "plugin": "Midas"
                },
                "0xbfc2d46a": {
                    "erc20OfInterest": [],
                    "method": "redeemRequest",
                    "plugin": "Midas"
                },
                "0xd5f73f5c": {
                    "erc20OfInterest": [],
                    "method": "redeemFiatRequest",
                    "plugin": "Midas"
                }
            }
        },
        {
            "address": "0x569D7dccBF6923350521ecBC28A555A500c4f0Ec",
            "contractName": "MTbillRedemptionVaultBuidl",
            "selectors": {
                "0x8b53f75e": {
                    "erc20OfInterest": [],
                    "method": "redeemInstant",
                    "plugin": "Midas"
                },
                "0xbfc2d46a": {
                    "erc20OfInterest": [],
                    "method": "redeemRequest",
                    "plugin": "Midas"
                },
                "0xd5f73f5c": {
                    "erc20OfInterest": [],
                    "method": "redeemFiatRequest",
                    "plugin": "Midas"
                }
            }
        },
        {
            "address": "0x0D89C1C4799353F3805A3E6C4e1Cbbb83217D123",
            "contractName": "MBasisRedemptionVaultSwapper",
            "selectors": {
                "0x8b53f75e": {
                    "erc20OfInterest": [],
                    "method": "redeemInstant",
                    "plugin": "Midas"
                },
                "0xbfc2d46a": {
                    "erc20OfInterest": [],
                    "method": "redeemRequest",
                    "plugin": "Midas"
                },
                "0xd5f73f5c": {
                    "erc20OfInterest": [],
                    "method": "redeemFiatRequest",
                    "plugin": "Midas"
                }
            }
        }
    ],
    "name": "Midas"
}