{
    "blockchainName": "ethereum",
    "chainId": 1,
    "contracts": [
        {
            "address": "0x9757f2d2b135150bbeb65308d4a91804107cd8d6",
            "contractName": "RaribleContract",
            "selectors": {
                "0xe2864fe3": {
                    "erc20OfInterest": [],
                    "method": "cancel",
                    "plugin": "Rarible"
                },
                "0xe99a3f80": {
                    "erc20OfInterest": [],
                    "method": "matchOrders",
                    "plugin": "Rarible"
                }
            }
        },
        {
            "address": "0x6e42262978de5233c8d5b05b128c121fba110da4",
            "contractName": "RaribleContract",
            "selectors": {
                "0x27050d1f": {
                    "erc20OfInterest": [],
                    "method": "createToken",
                    "plugin": "Rarible"
                }
            }
        },
        {
            "address": "0xf6793da657495ffeff9ee6350824910abc21356c",
            "contractName": "RaribleContract",
            "selectors": {
                "0x22a775b6": {
                    "erc20OfInterest": [],
                    "method": "mintAndTransfer",
                    "plugin": "Rarible"
                },
                "0x3db397c6": {
                    "erc20OfInterest": [],
                    "method": "__ERC721Rarible_init",
                    "plugin": "Rarible"
                },
                "0x832fbb29": {
                    "erc20OfInterest": [],
                    "method": "transferFromOrMint",
                    "plugin": "Rarible"
                },
                "0xa22cb465": {
                    "erc20OfInterest": [],
                    "method": "setApprovalForAll",
                    "plugin": "Rarible"
                }
            }
        },
        {
            "address": "0xc9154424b823b10579895ccbe442d41b9abd96ed",
            "contractName": "RaribleContract",
            "selectors": {
                "0x22a775b6": {
                    "erc20OfInterest": [],
                    "method": "mintAndTransfer",
                    "plugin": "Rarible"
                },
                "0x3db397c6": {
                    "erc20OfInterest": [],
                    "method": "__ERC721Rarible_init",
                    "plugin": "Rarible"
                },
                "0x832fbb29": {
                    "erc20OfInterest": [],
                    "method": "transferFromOrMint",
                    "plugin": "Rarible"
                },
                "0xa22cb465": {
                    "erc20OfInterest": [],
                    "method": "setApprovalForAll",
                    "plugin": "Rarible"
                }
            }
        }
    ],
    "name": "Rarible"
}