{
    "blockchainName": "ethereum",
    "chainId": 1,
    "contracts": [
        {
            "address": "0xa2761b0539374eb7af2155f76eb09864af075250",
            "contractName": "PassiveETH",
            "selectors": {
                "0x2e1a7d4d": {
                    "erc20OfInterest": [],
                    "method": "withdraw",
                    "plugin": "StakeDAO"
                },
                "0xb6b55f25": {
                    "erc20OfInterest": [],
                    "method": "deposit",
                    "plugin": "StakeDAO"
                },
                "0xde5f6268": {
                    "erc20OfInterest": [],
                    "method": "depositAll",
                    "plugin": "StakeDAO"
                }
            }
        },
        {
            "address": "0x9b8f14554f40705de7908879e2228d2ac94fde1a",
            "contractName": "ETHCallOpt",
            "selectors": {
                "0x5358fbda": {
                    "erc20OfInterest": [],
                    "method": "depositETH",
                    "plugin": "StakeDAO"
                },
                "0xc7cdea37": {
                    "erc20OfInterest": [],
                    "method": "withdrawETH",
                    "plugin": "StakeDAO"
                }
            }
        },
        {
            "address": "0x227e4635c5fe22d1e36dab1c921b62f8acc451b9",
            "contractName": "BTCCallOpt",
            "selectors": {
                "0x4d5693ab": {
                    "erc20OfInterest": [],
                    "method": "depositUnderlying",
                    "plugin": "StakeDAO"
                },
                "0xc22fb4ef": {
                    "erc20OfInterest": [],
                    "method": "withdrawUnderlying",
                    "plugin": "StakeDAO"
                },
                "0xcc8690ac": {
                    "erc20OfInterest": [],
                    "method": "depositCrvLp",
                    "plugin": "StakeDAO"
                },
                "0xecfe0521": {
                    "erc20OfInterest": [],
                    "method": "withdrawCrvLp",
                    "plugin": "StakeDAO"
                }
            }
        },
        {
            "address": "0xfea5e213bbd81a8a94d0e1edb09dbd7ceab61e1c",
            "contractName": "Masterchef",
            "selectors": {
                "0x441a3e70": {
                    "erc20OfInterest": [],
                    "method": "withdraw",
                    "plugin": "StakeDAO"
                },
                "0xe2bbb158": {
                    "erc20OfInterest": [],
                    "method": "deposit",
                    "plugin": "StakeDAO"
                }
            }
        },
        {
            "address": "0x20d1b558ef44a6e23d9bf4bf8db1653626e642c3",
            "contractName": "Premium",
            "selectors": {
                "0x2e1a7d4d": {
                    "erc20OfInterest": [],
                    "method": "withdraw",
                    "plugin": "StakeDAO"
                },
                "0x3d18b912": {
                    "erc20OfInterest": [],
                    "method": "getReward",
                    "plugin": "StakeDAO"
                },
                "0x7b0472f0": {
                    "erc20OfInterest": [],
                    "method": "stake",
                    "plugin": "StakeDAO"
                },
                "0xe9fad8ee": {
                    "erc20OfInterest": [],
                    "method": "exit",
                    "plugin": "StakeDAO"
                }
            }
        },
        {
            "address": "0xac14864ce5a98af3248ffbf549441b04421247d3",
            "contractName": "Sanctuary",
            "selectors": {
                "0x67dfd4c9": {
                    "erc20OfInterest": [],
                    "method": "leave",
                    "plugin": "StakeDAO"
                },
                "0xa59f3e0c": {
                    "erc20OfInterest": [],
                    "method": "enter",
                    "plugin": "StakeDAO"
                }
            }
        },
        {
            "address": "0x221738f73fa4bfca91918e77d112b87d918c751f",
            "contractName": "Palace",
            "selectors": {
                "0x2e1a7d4d": {
                    "erc20OfInterest": [],
                    "method": "withdraw",
                    "plugin": "StakeDAO"
                },
                "0xa694fc3a": {
                    "erc20OfInterest": [],
                    "method": "stake",
                    "plugin": "StakeDAO"
                }
            }
        },
        {
            "address": "0xa324a2e3a6f64bd588565e0e1e2dd50e7a68bdd9",
            "contractName": "NFtBoost",
            "selectors": {
                "0x2def6620": {
                    "erc20OfInterest": [],
                    "method": "unstake",
                    "plugin": "StakeDAO"
                },
                "0xa694fc3a": {
                    "erc20OfInterest": [],
                    "method": "stake",
                    "plugin": "StakeDAO"
                }
            }
        }
    ],
    "name": "StakeDAO"
}