{
    "blockchainName": "ethereum",
    "chainId": 1,
    "contracts": [
        {
            "address": "0xf03a7eb46d01d9ecaa104558c732cf82f6b6b645",
            "contractName": "MaticX",
            "selectors": {
                "0x745400c9": {
                    "erc20OfInterest": [],
                    "method": "requestWithdraw",
                    "plugin": "Staderlabs"
                },
                "0xea99c2a6": {
                    "erc20OfInterest": [],
                    "method": "submit",
                    "plugin": "Staderlabs"
                },
                "0xf8444436": {
                    "erc20OfInterest": [],
                    "method": "claimWithdrawal",
                    "plugin": "Staderlabs"
                }
            }
        },
        {
            "address": "0xcf5ea1b38380f6af39068375516daf40ed70d299",
            "contractName": "StaderStakePoolsManager",
            "selectors": {
                "0xb7482509": {
                    "erc20OfInterest": [],
                    "method": "deposit",
                    "plugin": "Staderlabs"
                }
            }
        },
        {
            "address": "0x9f0491b32dbce587c50c4c43ab303b06478193a7",
            "contractName": "UserWithdrawalManager",
            "selectors": {
                "0x1f7ec122": {
                    "erc20OfInterest": [],
                    "method": "requestWithdraw",
                    "plugin": "Staderlabs"
                },
                "0x379607f5": {
                    "erc20OfInterest": [],
                    "method": "claim",
                    "plugin": "Staderlabs"
                }
            }
        }
    ],
    "name": "Staderlabs"
}
