{
    "blockchainName": "ethereum",
    "chainId": 1,
    "contracts": [
        {
            "address": "0x11111112542d85b3ef69ae05771c2dccff4faa26",
            "contractName": "AggregationRouterV3",
            "selectors": {
                "0x2e95b6c8": {
                    "erc20OfInterest": [
                        "srcToken"
                    ],
                    "method": "unoswap",
                    "plugin": "1inch"
                },
                "0x7c025200": {
                    "erc20OfInterest": [
                        "desc.srcToken",
                        "desc.dstToken"
                    ],
                    "method": "swap",
                    "plugin": "1inch"
                }
            }
        },
        {
            "address": "0x1111111254fb6c44bac0bed2854e76f90643097d",
            "contractName": "AggregationRouterV4",
            "selectors": {
                "0x2521b930": {
                    "erc20OfInterest": [
                        "srcToken"
                    ],
                    "method": "uniswapV3SwapToWithPermit",
                    "plugin": "1inch"
                },
                "0x2e95b6c8": {
                    "erc20OfInterest": [
                        "srcToken"
                    ],
                    "method": "unoswap",
                    "plugin": "1inch"
                },
                "0x4cc4a27b": {
                    "erc20OfInterest": [],
                    "method": "fillOrderRFQToWithPermit",
                    "plugin": "1inch"
                },
                "0x7c025200": {
                    "erc20OfInterest": [
                        "desc.srcToken",
                        "desc.dstToken"
                    ],
                    "method": "swap",
                    "plugin": "1inch"
                },
                "0xa1251d75": {
                    "erc20OfInterest": [
                        "srcToken"
                    ],
                    "method": "unoswapWithPermit",
                    "plugin": "1inch"
                },
                "0xb0431182": {
                    "erc20OfInterest": [
                        "srcToken",
                        "dstToken"
                    ],
                    "method": "clipperSwap",
                    "plugin": "1inch"
                },
                "0xbc80f1a8": {
                    "erc20OfInterest": [],
                    "method": "uniswapV3SwapTo",
                    "plugin": "1inch"
                },
                "0xd0a3b665": {
                    "erc20OfInterest": [],
                    "method": "fillOrderRFQ",
                    "plugin": "1inch"
                },
                "0xd6a92a5d": {
                    "erc20OfInterest": [
                        "srcToken",
                        "dstToken"
                    ],
                    "method": "clipperSwapToWithPermit",
                    "plugin": "1inch"
                },
                "0xe449022e": {
                    "erc20OfInterest": [],
                    "method": "uniswapV3Swap",
                    "plugin": "1inch"
                }
            }
        },
        {
            "address": "0x1111111254eeb25477b68fb85ed929f73a960582",
            "contractName": "AggregationRouterV5",
            "selectors": {
                "0x0502b1c5": {
                    "erc20OfInterest": [
                        "srcToken"
                    ],
                    "method": "unoswap",
                    "plugin": "1inch"
                },
                "0x12aa3caf": {
                    "erc20OfInterest": [
                        "desc.srcToken",
                        "desc.dstToken"
                    ],
                    "method": "swap",
                    "plugin": "1inch"
                },
                "0x3c15fd91": {
                    "erc20OfInterest": [
                        "srcToken"
                    ],
                    "method": "unoswapToWithPermit",
                    "plugin": "1inch"
                },
                "0x3eca9c0a": {
                    "erc20OfInterest": [
                        "order.makerAsset",
                        "order.takerAsset"
                    ],
                    "method": "fillOrderRFQ",
                    "plugin": "1inch"
                },
                "0x70ccbd31": {
                    "erc20OfInterest": [
                        "order.makerAsset",
                        "order.takerAsset"
                    ],
                    "method": "fillOrderRFQToWithPermit",
                    "plugin": "1inch"
                },
                "0x84bd6d29": {
                    "erc20OfInterest": [
                        "srcToken",
                        "dstToken"
                    ],
                    "method": "clipperSwap",
                    "plugin": "1inch"
                },
                "0xc805a666": {
                    "erc20OfInterest": [
                        "srcToken",
                        "dstToken"
                    ],
                    "method": "clipperSwapToWithPermit",
                    "plugin": "1inch"
                }
            }
        }
    ],
    "name": "1inch"
}