{
    "blockchainName": "ethereum",
    "chainId": 1,
    "contracts": [
        {
            "address": "0xf0075b3cf8953d3e23b0ef65960913fd97eb5227",
            "contractName": "FigmentEth2Depositor",
            "selectors": {
                "0x4f498c73": {
                    "erc20OfInterest": [],
                    "method": "deposit",
                    "plugin": "Figment"
                }
            }
        }
    ],
    "name": "Figment"
}