{
    "blockchainName": "ethereum",
    "chainId": 1,
    "contracts": [
        {
            "address": "0x3fc91a3afd70395cd496c647d5a6cc9d4b2b7fad",
            "contractName": "UniversalRouter",
            "selectors": {
                "0x3593564c": {
                    "erc20OfInterest": [],
                    "method": "execute",
                    "plugin": "Uniswap"
                }
            }
        },
        {
            "address": "0x66a9893cc07d91d95644aedd05d03f95e1dba8af",
            "contractName": "UniversalRouter",
            "selectors": {
                "0x3593564c": {
                    "erc20OfInterest": [],
                    "method": "execute",
                    "plugin": "Uniswap"
                }
            }
        },
        {
            "address": "0x4c82d1fbfe28c977cbb58d8c7ff8fcf9f70a2cca",
            "contractName": "UniversalRouter",
            "selectors": {
                "0x3593564c": {
                    "erc20OfInterest": [],
                    "method": "execute",
                    "plugin": "Uniswap"
                }
            }
        }
    ],
    "name": "Uniswap"
}
