{
    "blockchainName": "ethereum",
    "chainId": 1,
    "contracts": [
        {
            "address": "0xce16f69375520ab01377ce7b88f5ba8c48f8d666",
            "contractName": "SquidRouterProxy",
            "selectors": {
                "0x3c659741": {
                    "erc20OfInterest": [],
                    "method": "bridgeCall",
                    "plugin": "Squid"
                },
                "0x8ca3bf68": {
                    "erc20OfInterest": [
                        "token"
                    ],
                    "method": "callBridgeCall",
                    "plugin": "Squid"
                },
                "0xf35af1f8": {
                    "erc20OfInterest": [
                        "token"
                    ],
                    "method": "callBridge",
                    "plugin": "Squid"
                }
            }
        },
        {
            "address": "0x4f4495243837681061c4743b74b3eedf548d56a5",
            "contractName": "AxelarGatewayProxyMultisig",
            "selectors": {
                "0x26ef699d": {
                    "erc20OfInterest": [],
                    "method": "sendToken",
                    "plugin": "Squid"
                }
            }
        }
    ],
    "name": "Squid"
}